{
  "schema": "cairn.module/v1-draft",
  "id": "boost",
  "version": 1,
  "name": "Boost and pulls",
  "status": "derived",
  "sources": [
    "MAP minus barometric is gauge pressure; format/v3 section 4.10 and OBDExtended.BoostGaugeKPa in the server's reference implementation",
    "the WOT pull detection of store/v1's v_pulls (throttle >= 70%, RPM rise > 500, >= 2 samples)"
  ],
  "requires": {
    "store": [
      "boost.map_kpa",
      "boost.baro_kpa",
      "obd.rpm",
      "obd.throttle_pct"
    ],
    "engine_fields": [
      "map_kpa",
      "baro_kpa",
      "rpm",
      "throttle_pct"
    ]
  },
  "derives": [
    {
      "column": "boost.boost_psi",
      "type": "DOUBLE",
      "expr": "CASE WHEN map_kpa IS NOT NULL AND baro_kpa IS NOT NULL THEN (map_kpa::DOUBLE - baro_kpa::DOUBLE) * 0.1450377 END",
      "note": "reproduces the column exactly as the server's decode path computes it today: a value whenever BOTH readings are present. It does NOT exclude a saturated manifold reading and does NOT treat a barometric reading of 0 as absent -- saturation is excluded by the views that read the column, not by the column. An earlier draft of this vector had `map_kpa < 255 AND baro_kpa > 0`, which would have silently turned every saturated sample's boost into NULL"
    }
  ],
  "metrics": [
    {
      "key": "boost_psi",
      "label": "Boost",
      "unit": "psi",
      "sample": "pull",
      "source_view": "v_pulls",
      "source_column": "peak_boost_psi",
      "trip_insight": {
        "label": "Peak boost",
        "agg": "max",
        "precision": 1
      },
      "dashboard_highlight": true,
      "ios_gauge": {
        "field": "boostKpa",
        "label": "Boost",
        "unit": "kPa",
        "precision": 1
      }
    }
  ],
  "views": [
    "store/views.sql"
  ],
  "queries": "api/queries.yaml",
  "ui": {
    "route": "/boost",
    "nav": {
      "label": "Turbo",
      "group": "detail",
      "order": 20,
      "icon": "lightning-bolt"
    },
    "vehicle_scope": "single"
  },
  "ios": {
    "trip_section": {
      "label": "Turbo",
      "order": 20
    }
  }
}
